{
  "type": "epistemic_document",
  "id": "MAP-WORLD-EBSTORF-1350",
  "title": "Ebstorfer Weltkarte",
  "domain": "cartography",
  "document_kind": "map",
  "date_range": {
    "start_year": 1230,
    "end_year": 1350,
    "approximate": true
  },
  "region_scope": [
    "world"
  ],
  "provenance": {
    "source_type": "archive",
    "source_reference": "Prof. Dr. Manfred Buchroithner - Die modernste Karte der Antarktis (Folie)",
    "notes": "Größte bekannte mittelalterliche Weltkarte. Original im 2. Weltkrieg zerstört, Rekonstruktion existiert."
  },
  "tags": [
    "medieval",
    "german",
    "mappa_mundi",
    "destroyed_original",
    "reconstruction"
  ],
  "created_at": "2026-02-02"
}