{
  "type": "epistemic_document",
  "id": "MAP-WORLD-SANUDO-1320",
  "title": "Marino Sanudo Weltkarte",
  "domain": "cartography",
  "document_kind": "map",
  "date_range": {
    "start_year": 1306,
    "end_year": 1321,
    "approximate": true
  },
  "creators": [
    {
      "name": "Marino Sanudo",
      "role": "cartographer"
    }
  ],
  "region_scope": [
    "world",
    "mediterranean"
  ],
  "provenance": {
    "source_type": "book",
    "source_reference": "Prof. Dr. Manfred Buchroithner - Die modernste Karte der Antarktis (Folie)",
    "notes": "Venezianischer Kreuzfahrer und Geograph. Liber Secretorum Fidelium Crucis."
  },
  "tags": [
    "medieval",
    "venetian",
    "crusades",
    "portolan_influence"
  ],
  "created_at": "2026-02-02"
}