{
  "type": "epistemic_document",
  "id": "MAP-WORLD-ANAXIMANDER-0600",
  "title": "Anaximander Weltkarte",
  "domain": "cartography",
  "document_kind": "map",
  "date_range": {
    "start_year": -610,
    "end_year": -546,
    "approximate": true
  },
  "creators": [
    {
      "name": "Anaximander",
      "role": "cartographer"
    }
  ],
  "region_scope": [
    "world",
    "mediterranean",
    "known_world"
  ],
  "provenance": {
    "source_type": "book",
    "source_reference": "Prof. Dr. Manfred Buchroithner - Die modernste Karte der Antarktis (Folie)",
    "notes": "Früheste bekannte griechische Weltkarte. Original nicht erhalten, nur aus Beschreibungen überliefert."
  },
  "tags": [
    "antique",
    "greek",
    "early_cartography",
    "reconstruction"
  ],
  "created_at": "2026-02-02"
}