{
  "type": "epistemic_document",
  "id": "MAP-WORLD-MARINUS-0120",
  "title": "Marinus of Tyre Weltkarte",
  "domain": "cartography",
  "document_kind": "map",
  "date_range": {
    "start_year": 100,
    "end_year": 120,
    "approximate": true
  },
  "creators": [
    {
      "name": "Marinus of Tyre",
      "role": "cartographer"
    }
  ],
  "region_scope": [
    "world",
    "mediterranean"
  ],
  "provenance": {
    "source_type": "book",
    "source_reference": "Prof. Dr. Manfred Buchroithner - Die modernste Karte der Antarktis (Folie)",
    "notes": "Griechisch-r√∂mischer Kartograph. Original nicht erhalten."
  },
  "tags": [
    "antique",
    "roman",
    "early_projection",
    "reconstruction"
  ],
  "created_at": "2026-02-02"
}