{
  "type": "epistemic_document",
  "id": "MAP-WORLD-STRABO-0020",
  "title": "Strabo Weltkarte",
  "domain": "cartography",
  "document_kind": "map",
  "date_range": {
    "start_year": -64,
    "end_year": 24,
    "approximate": true
  },
  "creators": [
    {
      "name": "Strabo",
      "role": "cartographer"
    }
  ],
  "region_scope": [
    "world",
    "mediterranean"
  ],
  "provenance": {
    "source_type": "book",
    "source_reference": "Prof. Dr. Manfred Buchroithner - Die modernste Karte der Antarktis (Folie)",
    "notes": "Griechischer Geograph und Historiker. Originalkarte nicht erhalten."
  },
  "tags": [
    "antique",
    "greek",
    "geography",
    "reconstruction"
  ],
  "created_at": "2026-02-02"
}