{
  "type": "epistemic_document",
  "id": "MAP-MEDITERRANEAN-DULCERT-1339",
  "title": "Dulcert Portolan",
  "domain": "cartography",
  "document_kind": "map",
  "date_range": {
    "start_year": 1339,
    "end_year": 1339,
    "approximate": false
  },
  "creators": [
    {
      "name": "Angelino Dulcert",
      "role": "cartographer"
    }
  ],
  "region_scope": [
    "mediterranean"
  ],
  "provenance": {
    "source_type": "archive",
    "source_reference": "Prof. Dr. Manfred Buchroithner - Die modernste Karte der Antarktis (Folie)",
    "notes": "Fr√ºhe Portolankarte aus Mallorca."
  },
  "tags": [
    "medieval",
    "portolan",
    "mallorcan",
    "navigational",
    "preserved"
  ],
  "created_at": "2026-02-02"
}