{
  "type": "epistemic_document",
  "id": "MAP-WORLD-COSMAS-0600",
  "title": "Cosmas Indicopleustes Weltkarte",
  "domain": "cartography",
  "document_kind": "map",
  "date_range": {
    "start_year": 550,
    "end_year": 600,
    "approximate": true
  },
  "creators": [
    {
      "name": "Cosmas Indicopleustes",
      "role": "cartographer"
    }
  ],
  "region_scope": [
    "world"
  ],
  "provenance": {
    "source_type": "book",
    "source_reference": "Prof. Dr. Manfred Buchroithner - Die modernste Karte der Antarktis (Folie)",
    "notes": "Byzantinischer Kaufmann und Theologe. Flache Erde Modell."
  },
  "tags": [
    "medieval",
    "byzantine",
    "flat_earth",
    "religious_cosmology"
  ],
  "created_at": "2026-02-02"
}