{
  "type": "epistemic_document",
  "id": "MAP-WORLD-PTOLEMY-0150",
  "title": "Claudius Ptolemaeus Weltkarte",
  "domain": "cartography",
  "document_kind": "map",
  "date_range": {
    "start_year": 150,
    "end_year": 150,
    "approximate": false
  },
  "creators": [
    {
      "name": "Claudius Ptolemaeus",
      "role": "cartographer"
    }
  ],
  "region_scope": [
    "world",
    "mediterranean"
  ],
  "provenance": {
    "source_type": "book",
    "source_reference": "Prof. Dr. Manfred Buchroithner - Die modernste Karte der Antarktis (Folie)",
    "notes": "Fundamentales Werk 'Geographia'. Originale Karten nicht erhalten, aber durch spätere Kopien überliefert."
  },
  "tags": [
    "antique",
    "roman",
    "projection",
    "coordinate_system",
    "seminal_work"
  ],
  "created_at": "2026-02-02"
}