{
  "type": "epistemic_document",
  "id": "MAP-WORLD-ALIDRISI-1154",
  "title": "Al-Idrisi Weltkarte (Tabula Rogeriana)",
  "domain": "cartography",
  "document_kind": "map",
  "date_range": {
    "start_year": 1154,
    "end_year": 1154,
    "approximate": false
  },
  "creators": [
    {
      "name": "Muhammad al-Idrisi",
      "role": "cartographer"
    }
  ],
  "region_scope": [
    "world"
  ],
  "provenance": {
    "source_type": "book",
    "source_reference": "Prof. Dr. Manfred Buchroithner - Die modernste Karte der Antarktis (Folie)",
    "notes": "Im Auftrag von KÃ¶nig Roger II. von Sizilien. Eines der fortgeschrittensten mittelalterlichen Werke."
  },
  "tags": [
    "medieval",
    "islamic",
    "sicily",
    "seminal_work",
    "preserved"
  ],
  "created_at": "2026-02-02"
}