{
  "type": "epistemic_document",
  "id": "MAP-EUROPE-TABULA-PEUTINGERIANA-0400",
  "title": "Tabula Peutingeriana",
  "domain": "cartography",
  "document_kind": "map",
  "date_range": {
    "start_year": 300,
    "end_year": 400,
    "approximate": true
  },
  "region_scope": [
    "europe",
    "mediterranean",
    "roman_empire"
  ],
  "provenance": {
    "source_type": "archive",
    "source_reference": "Prof. Dr. Manfred Buchroithner - Die modernste Karte der Antarktis (Folie)",
    "notes": "Römisches Straßen-Itinerar. Einzigartiges erhaltenes Exemplar in Österreichische Nationalbibliothek."
  },
  "tags": [
    "antique",
    "roman",
    "itinerary_map",
    "road_network",
    "preserved_original"
  ],
  "created_at": "2026-02-02"
}