{
  "type": "epistemic_document",
  "id": "MAP-WORLD-CAVERIO-1505",
  "title": "Caverio / Canerio Weltkarte",
  "domain": "cartography",
  "document_kind": "map",
  "date_range": {
    "start_year": 1503,
    "end_year": 1505,
    "approximate": true
  },
  "creators": [
    {
      "name": "Nicolò de Caveri",
      "role": "cartographer"
    }
  ],
  "region_scope": [
    "world",
    "atlantic",
    "south_america",
    "africa"
  ],
  "technical": {
    "projection": "unknown/portolan-influenced",
    "measurement_basis": [
      "portolan",
      "maritime_navigation"
    ],
    "medium": "parchment"
  },
  "provenance": {
    "source_type": "transcript",
    "source_reference": "Die modernste Karte der Antarktis - Prof. Dr. Manfred Buchroithner (Transcript)",
    "notes": "Mentioned in list of major world maps. Original held in Bibliothèque nationale de France."
  },
  "claims_and_limits": {
    "commonly_stated_claims": [
      "Early detailed coastal depiction of parts of South America and Africa.",
      "One of the earliest maps to show the newly discovered lands of the Americas."
    ],
    "known_limits": [
      "Not a full global accuracy claim; coastal detail varies by region.",
      "Some regions show conjectural coastlines, particularly in the southern Atlantic."
    ]
  },
  "links": [],
  "tags": [
    "world_map",
    "early_modern",
    "portolan",
    "discovery_period"
  ],
  "created_at": "2026-02-02"
}