{
  "type": "epistemic_document",
  "id": "MAP-MEDITERRANEAN-CATALANO-1350",
  "title": "Catalano Portolan",
  "domain": "cartography",
  "document_kind": "map",
  "date_range": {
    "start_year": 1350,
    "end_year": 1375,
    "approximate": true
  },
  "creators": [
    {
      "name": "Anonymous (Catalan School)",
      "role": "cartographer"
    }
  ],
  "region_scope": [
    "mediterranean"
  ],
  "provenance": {
    "source_type": "archive",
    "source_reference": "Prof. Dr. Manfred Buchroithner - Die modernste Karte der Antarktis (Folie)",
    "notes": "Katalanische Portolankarte."
  },
  "tags": [
    "medieval",
    "portolan",
    "catalan",
    "navigational",
    "preserved"
  ],
  "created_at": "2026-02-02"
}