{
  "type": "epistemic_document",
  "id": "MAP-WORLD-CANTINO-1502",
  "title": "Cantino Planisphere",
  "domain": "cartography",
  "document_kind": "map",
  "date_range": {
    "start_year": 1502,
    "end_year": 1502,
    "approximate": false
  },
  "region_scope": [
    "world",
    "atlantic",
    "indian_ocean"
  ],
  "provenance": {
    "source_type": "archive",
    "source_reference": "Prof. Dr. Manfred Buchroithner - Die modernste Karte der Antarktis (Folie)",
    "notes": "Eine der Ã¤ltesten erhaltenen Karten mit portugiesischen Entdeckungen."
  },
  "tags": [
    "early_modern",
    "portuguese",
    "discovery",
    "preserved"
  ],
  "created_at": "2026-02-02"
}