{
  "type": "epistemic_document",
  "id": "MAP-WORLD-ISIDORE-0630",
  "title": "Isidore of Seville Weltkarte",
  "domain": "cartography",
  "document_kind": "map",
  "date_range": {
    "start_year": 630,
    "end_year": 630,
    "approximate": false
  },
  "creators": [
    {
      "name": "Isidore of Seville",
      "role": "cartographer"
    }
  ],
  "region_scope": [
    "world"
  ],
  "provenance": {
    "source_type": "book",
    "source_reference": "Prof. Dr. Manfred Buchroithner - Die modernste Karte der Antarktis (Folie)",
    "notes": "Spanischer Bischof und Gelehrter. T-O Schema."
  },
  "tags": [
    "medieval",
    "spanish",
    "t-o_map",
    "religious_cosmology"
  ],
  "created_at": "2026-02-02"
}